link,text,date,No_of_Likes,No_of_Retweets
https://twitter.com/CNN/status/1796598756046954623#m,"President Biden addressed Trump's conviction in the hush money trial, saying it reaffirms ""the American principle that no one is above the law"" https://cnn.it/3yEFVct","May 31, 2024 · 5:44 PM UTC",645,115
https://twitter.com/CNN/status/1796598323505193159#m,"In a grievance-filled speech riddled with falsehoods, Trump says the crime he was convicted of ""sounds bad"" but insists he did nothing wrong https://cnn.it/4c0jhtD","May 31, 2024 · 5:43 PM UTC",358,75
https://twitter.com/CNN/status/1796559312875102290#m,"Donald Trump is holding a news conference at Trump Tower, one day after he was found guilty of all 34 counts of falsifying business records. Follow live updates. https://cnn.it/454rxGE","May 31, 2024 · 3:08 PM UTC",341,83
https://twitter.com/CNN/status/1796556012926681174#m,"Sen. Joe Manchin of West Virginia, a longtime Democrat, announces that he has registered as an independent https://cnn.it/3wZLQZk","May 31, 2024 · 2:55 PM UTC",362,77
https://twitter.com/CNN/status/1796540462280437887#m,"The Biden administration is preparing to roll out a sweeping border executive action, sources say, in hopes to blunt GOP attacks on border security https://cnn.it/3VoGSyO","May 31, 2024 · 1:53 PM UTC",327,99
https://twitter.com/CNN/status/1796531532707901813#m,"The Israeli military is in central Rafah, IDF confirms, defying international pressure and warnings of a humanitarian crisis in the southern Gaza city https://cnn.it/3R7w5WY","May 31, 2024 · 1:17 PM UTC",177,64
https://twitter.com/CNN/status/1796523002575622238#m,"The Fed's preferred inflation gauge didn't budge in April, yet another reminder of stubborn price pressures https://cnn.it/3R9OmDf","May 31, 2024 · 12:43 PM UTC",87,35
https://twitter.com/CNN/status/1796368353331666947#m,"Bruhat Soma, a 12-year-old from Florida, wins the Scripps National Spelling Bee. https://cnn.it/3KkMaFb","May 31, 2024 · 2:29 AM UTC",810,96
https://twitter.com/CNN/status/1796342916102693312#m,Donald Trump appeared relaxed before the verdict. But then everything changed when the judge returned with a stunning note from the jury.  Here's a look from inside the courtroom. https://cnn.it/3R8jLpk,"May 31, 2024 · 12:48 AM UTC",580,122
https://twitter.com/CNN/status/1796312107270418468#m,"Donald Trump is now a convicted felon after being found guilty on all 34 charges in the hush money trial. Yes, he can still run for president.  Your questions, answered. https://cnn.it/3yEAkDh","May 30, 2024 · 10:45 PM UTC",2936,454
https://twitter.com/CNN/status/1796290610820759816#m,Donald Trump is now a convicted felon. He frowned as 34 guilty counts were read out. He will be sentenced on July 11. https://cnn.it/3wNg3uH,"May 30, 2024 · 9:20 PM UTC",11403,1571
https://twitter.com/CNN/status/1796288607797350592#m,Jurors find Donald Trump falsified business records in New York hush money trial. He becomes the first former US president to be convicted in criminal court. https://cnn.it/3V172pP,"May 30, 2024 · 9:12 PM UTC",24919,4410
https://twitter.com/CNN/status/1796281492445843592#m,The jury has reached a verdict in former President Trump's criminal hush money trial. Watch CNN and follow live updates as it's read. https://cnn.it/4bGBjBg,"May 30, 2024 · 8:44 PM UTC",1061,223
https://twitter.com/CNN/status/1796278194355495092#m,"President Biden has given Ukraine permission to carry out limited strikes within Russia using American munitions, US officials tell CNN https://cnn.it/45kVsuB","May 30, 2024 · 8:31 PM UTC",914,215
https://twitter.com/CNN/status/1796277576702267577#m,Chad Daybell has been found guilty of murder and conspiracy charges in the deaths of his first wife and the two children of his second wife https://cnn.it/451EiSv,"May 30, 2024 · 8:28 PM UTC",302,57
https://twitter.com/CNN/status/1796245045529518099#m,Chief Justice Roberts rejected a meeting request from Democratic lawmakers who wanted to discuss provocative flags hoisted at Justice Alito's properties https://cnn.it/4bH5jwY,"May 30, 2024 · 6:19 PM UTC",424,106
https://twitter.com/CNN/status/1796234375639585063#m,"A third person in the US has tested positive for H5 bird flu in connection to an outbreak in dairy cattle, the Michigan Department of Health and Human Services said. CDC maintains its assessment that risk to public is low. https://cnn.it/3KlFyX5","May 30, 2024 · 5:37 PM UTC",249,105
https://twitter.com/CNN/status/1796186954511356060#m,Supreme Court unanimously backs the NRA in free speech lawsuit against New York official who urged companies to cut ties with the gun rights group https://cnn.it/3Vn6o7e,"May 30, 2024 · 2:28 PM UTC",254,88
https://twitter.com/CNN/status/1796008618409459946#m,Hong Kong democracy leaders convicted on subversion charges in the most significant verdicts yet since Beijing's national security crackdown. https://cnn.it/3R18tmL,"May 30, 2024 · 2:39 AM UTC",148,54
https://twitter.com/CNN/status/1795968152771125731#m,Three-time Olympic champion Gabby Douglas has ended her 2024 Summer Games bid. She returned to gymnastics last month after a nearly 8-year competition hiatus. https://cnn.it/3R5szMM,"May 29, 2024 · 11:59 PM UTC",241,63
https://twitter.com/CNN/status/1795943497230364862#m,The jury in Trump's hush money trial finished its first day of deliberations without reaching a verdict. Here's what you should know. https://cnn.it/3Kt2cfX,"May 29, 2024 · 10:21 PM UTC",234,71
https://twitter.com/CNN/status/1795910666294903294#m,The House Ethics Committee has set up an investigative panel to probe the actions of Democratic Rep. Henry Cuellar of Texas after he was charged in federal court with accepting bribes https://cnn.it/3yymeDa,"May 29, 2024 · 8:10 PM UTC",163,46
https://twitter.com/CNN/status/1795900003086487786#m,The jurors in Donald Trump's hush money trial have asked the judge to read back testimony from Michael Cohen and David Pecker about the 2015 Trump Tower meeting.  Follow live updates. https://cnn.it/4e1KayZ,"May 29, 2024 · 7:28 PM UTC",241,67
https://twitter.com/CNN/status/1795875634482221383#m,Supreme Court Justice Samuel Alito says he will not recuse from January 6-related cases after backlash over controversial flags flown on his properties https://cnn.it/4aGdOHn,"May 29, 2024 · 5:51 PM UTC",1078,231
https://twitter.com/CNN/status/1795872443132739889#m,All charges have been dismissed against world No. 1 golfer Scottie Scheffler after his arrest on his way to the PGA Championship in Louisville https://cnn.it/4bEBc9k,"May 29, 2024 · 5:38 PM UTC",224,45
https://twitter.com/CNN/status/1795855578218049873#m,A lawsuit filed on behalf of three Black men alleges race discrimination by American Airlines. The passengers say they were kicked off a flight because of a false body odor complaint. https://cnn.it/4e23wE6,"May 29, 2024 · 4:31 PM UTC",160,59
https://twitter.com/CNN/status/1795840881779486896#m,Jurors begin deliberating in the New York hush money trial against former President Trump. https://www.cnn.com/webview/politics/live-news/trump-hush-money-trial-05-29-24/h_899bae23b1b6fb3cc2af41db4e912584?Date=20240529&Profile=CNN&utm_content=1716996805&utm_medium=social&utm_source=twitter,"May 29, 2024 · 3:33 PM UTC",172,40
https://twitter.com/CNN/status/1795832140921266491#m,A top Israeli security official says he expects 'another seven months of fighting' in Gaza will be needed to defeat Hamas. Follow live updates. https://cnn.it/3R0S2ao,"May 29, 2024 · 2:58 PM UTC",131,50
https://twitter.com/CNN/status/1795823299873673711#m,The judge is instructing the jury as to the law and charges they must consider against Donald Trump in the New York criminal hush money trial before they begin to deliberate on a verdict. Follow live updates.  https://cnn.it/3R753it,"May 29, 2024 · 2:23 PM UTC",157,36
https://twitter.com/CNN/status/1795799669152309684#m,ConocoPhillips agrees to buy Marathon Oil in an all-stock deal worth $22.5 billion https://cnn.it/4e1sFyK,"May 29, 2024 · 12:49 PM UTC",114,58
https://twitter.com/CNN/status/1795764373375336791#m,Millions are voting in what is expected to be the most pivotal general election in South Africa since the end of apartheid https://cnn.it/3R4cwPu,"May 29, 2024 · 10:29 AM UTC",124,51
https://twitter.com/CNN/status/1795762334855483438#m,"Federal investigators are preparing to bring accusers of musical mogul Sean ""Diddy"" Combs before a federal grand jury, two sources tell CNN https://cnn.it/3R1jUuQ","May 29, 2024 · 10:21 AM UTC",412,232
https://twitter.com/CNN/status/1795616515372224894#m,Jurors are expected to begin deliberations before lunch Wednesday as the historic Trump hush money trial nears its end. Here are takeaways from closing arguments. https://cnn.it/4aHDp2B,"May 29, 2024 · 12:41 AM UTC",272,78
https://twitter.com/CNN/status/1795604677146423652#m,Haiti's transitional council picks former Prime Minister Garry Conille to return to the position during the government's transition period https://cnn.it/3wVOPC8,"May 28, 2024 · 11:54 PM UTC",111,49
https://twitter.com/CNN/status/1795578355124699216#m,"During recent military drills with Cambodia, China’s military showed off a robot dog with a rifle mounted on its back https://cnn.it/3KklPH7","May 28, 2024 · 10:10 PM UTC",141,58
https://twitter.com/CNN/status/1795555071100346594#m,"Feeding smooth peanut butter to infants and toddlers can help protect against developing an allergy to peanuts even years later, a new study finds https://cnn.it/4aHf7Wt","May 28, 2024 · 8:37 PM UTC",449,110
https://twitter.com/CNN/status/1795535282911039649#m,1 million customers are without power in Texas as hurricane-force winds slam Dallas and Houston https://cnn.it/3KgY6aZ,"May 28, 2024 · 7:19 PM UTC",211,81
https://twitter.com/CNN/status/1795518746263425425#m,The defense wrapped its closing arguments in the Trump hush money trial. Now prosecutors will try to convince a jury that the former president broke the law. Follow live updates. https://cnn.it/4dZzhxJ,"May 28, 2024 · 6:13 PM UTC",211,56
https://twitter.com/CNN/status/1795516118305529941#m,"The pier built by the US military to deliver aid to Gaza broke apart, in a major blow to humanitarian relief efforts https://cnn.it/4bCQpHY","May 28, 2024 · 6:02 PM UTC",346,152
https://twitter.com/CNN/status/1795479573162754364#m,Federal judge rejects special counsel's request for a gag order against Trump in the classified documents case. https://www.cnn.com/2024/05/28/politics/trump-gag-order-cannon-classified-documents?Date=20240528&Profile=CNN&utm_content=1716910663&utm_medium=social&utm_source=twitter,"May 28, 2024 · 3:37 PM UTC",275,82
https://twitter.com/CNN/status/1795451218703069442#m,Pope Francis apologizes for using a homophobic slur during a meeting with bishops https://cnn.it/4dVgJPb,"May 28, 2024 · 1:45 PM UTC",264,85
https://twitter.com/CNN/status/1795442475768664102#m,"Israeli tanks seen in central Rafah for the first time, witnesses say, despite growing global condemnation of Israel's operation https://cnn.it/44XNJCc","May 28, 2024 · 1:10 PM UTC",220,86
https://twitter.com/CNN/status/1795431886547833326#m,"Nearly 600,000 customers are without power in Texas and that number is expected to climb as destructive storms slam the Dallas-Fort Worth area https://cnn.it/4bN4W3O","May 28, 2024 · 12:28 PM UTC",318,121
https://twitter.com/CNN/status/1795157153860215273#m,"Hall of Famer and two-time NBA champion Bill Walton has died at age 71 following a prolonged battle with cancer, the league announced https://cnn.it/3UVJZN7","May 27, 2024 · 6:16 PM UTC",1476,143
https://twitter.com/CNN/status/1795142511687512201#m,"Israeli Prime Minister Benjamin Netanyahu calls the deadly airstrike on a Rafah camp ""a tragic mistake."" IDF says it is investigating the incident. https://cnn.it/44Y4SvC","May 27, 2024 · 5:18 PM UTC",485,151
https://twitter.com/CNN/status/1795133461415489542#m,"Rafael Nadal, a 14-time French Open winner, was knocked out in the first round by Alexander Zverev in what could be his final appearance at the tournament https://cnn.it/4e80HBM","May 27, 2024 · 4:42 PM UTC",265,59
https://twitter.com/CNN/status/1795096965941702864#m,"At least 19 people are dead in the US after an extremely active weekend of severe storms. Today, parts of the East Coast are at risk for tornadoes. https://cnn.it/3VexX2M","May 27, 2024 · 2:17 PM UTC",268,69
https://twitter.com/CNN/status/1795067250061303944#m,"Death toll from Israel's strike on Rafah rises to 45, Gaza officials say. Countries call on Israel to abide by ICJ's ruling ordering a halt in Rafah.   Follow live updates. https://cnn.it/3x1Clst","May 27, 2024 · 12:19 PM UTC",375,157
https://twitter.com/CNN/status/1795009296591126841#m,"As many as 2,000 people feared buried under massive Papua New Guinea landslide, national disaster agency says https://cnn.it/4aC5lVD","May 27, 2024 · 8:29 AM UTC",294,78
https://twitter.com/CNN/status/1794880054805037076#m,Josef Newgarden wins Indianapolis 500 for the second consecutive year in a race that started four hours late due to weather. https://cnn.it/3yKFSvJ,"May 26, 2024 · 11:55 PM UTC",507,72
https://twitter.com/CNN/status/1794871024124592225#m,"At least 35 people were killed in Israeli strikes on a camp for displaced people in Rafah, Gaza officials say. Israel's military says it hit a Hamas compound, killing 2 senior figures. Follow live updates. https://cnn.it/4dWe9s3","May 26, 2024 · 11:19 PM UTC",3219,739
https://twitter.com/CNN/status/1794843335569404331#m,"At least 15 people are dead after severe storms and suspected tornadoes struck the central US overnight.  More than 110 million people across swaths of the US are under threat of large hail, damaging winds and fierce twisters Sunday. Follow live updates. https://cnn.it/44YlraQ","May 26, 2024 · 9:29 PM UTC",270,72
https://twitter.com/CNN/status/1794761290138706029#m,Start of Indy 500 delayed and spectators moved out of grandstands due to lightning risk with parts of Midwest under storm threat. Follow live updates. https://www.cnn.com/weather/live-news/oklahoma-texas-kansas-tornado-storms-05-26-24/h_10255a70c22f4a79b39b9daf05f97385?Date=20240526&Profile=CNN&utm_content=1716739411&utm_medium=social&utm_source=twitter,"May 26, 2024 · 4:03 PM UTC",266,49
https://twitter.com/CNN/status/1794726603819204961#m,"12 people injured during turbulence on Qatar Airways flight from Doha to Dublin, just days after Singapore Airlines death https://cnn.it/3UZoLxK","May 26, 2024 · 1:45 PM UTC",283,131
https://twitter.com/CNN/status/1794703603048865899#m,"Sirens sounded in Tel Aviv, says the IDF, marking the first time rockets have been fired at the city in months. Hamas has claimed responsibility. https://cnn.it/3yD3ClB","May 26, 2024 · 12:14 PM UTC",236,74
https://twitter.com/CNN/status/1794697626262130861#m,"At least five people, including children, are dead after a possible tornado struck Texas overnight. Storm warnings continue today across Central US. https://cnn.it/3UVpmjZ","May 26, 2024 · 11:50 AM UTC",168,71
https://twitter.com/CNN/status/1794694755609088041#m,"More than 670 people now feared dead after landslide hit remote area of Papua New Guinea, UN says https://cnn.it/3Khpwxh","May 26, 2024 · 11:39 AM UTC",166,76
https://twitter.com/CNN/status/1794522810192195961#m,"Richard M. Sherman, one half of the Oscar-winning songwriting duo behind ""Mary Poppins"" and ""It's a Small World,"" has died. He was 95. https://cnn.it/3wGqr7t","May 26, 2024 · 12:15 AM UTC",431,101
https://twitter.com/CNN/status/1794464601888694310#m,"Golfer Grayson Murray has died, one day after withdrawing from the Charles Schwab Challenge in Fort Worth, Texas, tour officials say https://cnn.it/3KBS3hr","May 25, 2024 · 8:24 PM UTC",377,91
https://twitter.com/CNN/status/1794460639370330550#m,"Nicki Minaj was stopped by Dutch authorities over the weekend for allegedly ""carrying drugs,"" according to police. https://cnn.it/3KiaVli","May 25, 2024 · 8:08 PM UTC",225,64
https://twitter.com/CNN/status/1794179074669056053#m,Special counsel’s office prosecutors have asked a federal judge in Florida to place a gag order on Donald Trump that would limit his ability to comment about law enforcement that searched his Mar-a-Lago resort. https://cnn.it/4dSiRXY,"May 25, 2024 · 1:30 AM UTC",764,158
https://twitter.com/CNN/status/1794143731471294508#m,"Kabosu, the Japanese shiba inu that launched countless ""doge"" memes, has died, her owner announced https://cnn.it/3QVCXH1","May 24, 2024 · 11:09 PM UTC",695,201
https://twitter.com/CNN/status/1794134925441933585#m,"Louisiana GOP Gov. Jeff Landry has signed a bill classifying the abortion-inducing drugs misoprostol and mifepristone as Schedule IV controlled dangerous substances, a first-of-its-kind law that places them in the same category as narcotics and depressants https://cnn.it/3WZ9nnJ","May 24, 2024 · 10:34 PM UTC",144,78
https://twitter.com/CNN/status/1794052892573245584#m,"A married couple from the US who were serving as missionaries in Haiti were attacked and killed by a gang, family says https://cnn.it/4btjHJh","May 24, 2024 · 5:08 PM UTC",334,106
https://twitter.com/CNN/status/1794038365102264686#m,"An American charged with carrying ammunition in Turks and Caicos gets suspended 52-week prison sentence, his advocate says https://cnn.it/3KhPEs2","May 24, 2024 · 4:10 PM UTC",112,42
https://twitter.com/CNN/status/1794023802705269084#m,"Morgan Spurlock, the filmmaker and former CNN series host whose McDonald's documentary ""Super Size Me"" was nominated for an Academy Award, has died at age 53. https://cnn.it/4dVFaMA","May 24, 2024 · 3:13 PM UTC",219,82
https://twitter.com/CNN/status/1794000344566899054#m,"UN's top court orders Israel to halt its military operation in Rafah, increasing global pressure on the Israeli government over its war in Gaza https://cnn.it/3R0xfnj","May 24, 2024 · 1:39 PM UTC",276,94
https://twitter.com/CNN/status/1793812924860953086#m,NCAA and power conferences agree to settlement terms to pave way to allow schools to pay student-athletes https://cnn.it/3wEctTB,"May 24, 2024 · 1:15 AM UTC",214,75
https://twitter.com/CNN/status/1793765391505723644#m,"The number of young people in the US who are prescribed GLP-1 agonist drugs like Wegovy and Ozempic for weight loss and diabetes soared 594.4% in just three years, according to new research https://cnn.it/3USdnny","May 23, 2024 · 10:06 PM UTC",167,66
https://twitter.com/CNN/status/1793741535361593722#m,JUST IN: Baltimore's former top prosecutor Marilyn Mosby avoids prison time and is sentenced to 12 months of home confinement for mortgage fraud and perjury https://cnn.it/4bSh4R4,"May 23, 2024 · 8:31 PM UTC",210,107
https://twitter.com/CNN/status/1793717499415941564#m,"JUST IN: A sweeping bipartisan border security bill has failed in the Senate for the second time, blocked by GOP opposition and Democratic divisions https://cnn.it/4dPLe9h","May 23, 2024 · 6:55 PM UTC",152,62
https://twitter.com/CNN/status/1793713455607738807#m,JUST IN: The Dow falls by more than 600 points as markets continue to fret about a rate cut https://cnn.it/3QUoCuk,"May 23, 2024 · 6:39 PM UTC",131,56
https://twitter.com/CNN/status/1793707537516097874#m,JUST IN: Louisiana lawmakers have approved a bill to classify abortion drugs as controlled dangerous substances. The governor has signaled his support for the measure. https://cnn.it/3KgaGHy,"May 23, 2024 · 6:16 PM UTC",184,85
https://twitter.com/CNN/status/1793696294940061700#m,"More than 20 of the dozens hurt during severe turbulence on a Singapore Airlines flight suffered spinal injuries, a hospital that treated some of the passengers says https://cnn.it/4bPrbpx","May 23, 2024 · 5:31 PM UTC",165,50
https://twitter.com/CNN/status/1793686484907651113#m,"The EPA and the Department of Justice have reached a $310 million settlement agreement with Norfolk Southern after last year's train derailment that spilled more than a million pounds of hazardous chemicals into the soil, water and air in Ohio. https://cnn.it/4bQWgcA","May 23, 2024 · 4:52 PM UTC",163,59
https://twitter.com/CNN/status/1793678494599123231#m,"The Louisville detective who arrested golfer Scottie Scheffler was disciplined for not activating his body camera, the police chief says https://cnn.it/4c8hF19","May 23, 2024 · 4:20 PM UTC",160,49
https://twitter.com/CNN/status/1793654068201636178#m,"The US government sued Live Nation for antitrust violations, alleging Ticketmaster and its parent company's practices harmed concertgoers https://cnn.it/3VcAVVl","May 23, 2024 · 2:43 PM UTC",184,52
https://twitter.com/CNN/status/1793637234010198165#m,"Cassie Ventura breaks her silence on 2016 surveillance video that showed her being physically assaulted by then-boyfriend Sean ""Diddy"" Combs https://cnn.it/3wMiBcl","May 23, 2024 · 1:36 PM UTC",135,52
https://twitter.com/CNN/status/1793562569749192941#m,"At least nine people are dead, and dozens have been injured after heavy winds caused damage at a campaign rally in Mexico https://cnn.it/3ytPQll","May 23, 2024 · 8:40 AM UTC",106,46
https://twitter.com/CNN/status/1793429812645679405#m,"The Justice Department and several states are expected to file a lawsuit as soon as this week against Live Nation, citing alleged antitrust violations, a source says https://cnn.it/3WTyYyq","May 22, 2024 · 11:52 PM UTC",238,101
https://twitter.com/CNN/status/1793419685763133647#m,"After one hearing in the Trump classified documents case devolves into a shouting match, the judge says the case may be too difficult for jurors to understand https://cnn.it/44VD7nr","May 22, 2024 · 11:12 PM UTC",205,95
https://twitter.com/CNN/status/1793407491092394317#m,"Inside the battle for Lyptsi, the small town that Ukraine cannot afford to lose to Russia https://cnn.it/4av8yGw","May 22, 2024 · 10:24 PM UTC",119,49
https://twitter.com/CNN/status/1793388574483562553#m,JUST IN: Nvidia has announced a 10-for-1 stock split as the company posts another impressive quarter of revenue and profit growth https://cnn.it/3VbGtiT,"May 22, 2024 · 9:08 PM UTC",147,56
https://twitter.com/CNN/status/1793386576405221877#m,Nikki Haley says she will vote for Donald Trump in her first public remarks since ending her presidential campaign https://cnn.it/4avFiiW,"May 22, 2024 · 9:00 PM UTC",320,78
https://twitter.com/CNN/status/1793366889009447315#m,Hunter Biden's trial on tax charges has been delayed until September. The president's son will still go on trial for gun-related charges next month. https://cnn.it/3Va9sUd,"May 22, 2024 · 7:42 PM UTC",161,53
https://twitter.com/CNN/status/1793345039231332525#m,A woman who accused movie mogul Harvey Weinstein of assault sees parallels between Trump's hush money trial and her own accusations https://cnn.it/3KeDDne,"May 22, 2024 · 6:15 PM UTC",194,72
https://twitter.com/CNN/status/1793336095632974004#m,"Uvalde, Texas, families have settled a lawsuit with the city over the 2022 mass shooting and say they are suing the school district and 92 police officers https://cnn.it/3WMOgFb","May 22, 2024 · 5:40 PM UTC",164,68
https://twitter.com/CNN/status/1793324014061924806#m,The families of seven female IDF soldiers captured October 7 released graphic video of their abduction to pressure the government to secure their release https://cnn.it/3wBJsb7,"May 22, 2024 · 4:52 PM UTC",209,82
https://twitter.com/CNN/status/1793299422299758954#m,"Two people are dead and three are injured after a shooting at a linen company in Chester, Pennsylvania https://cnn.it/3WR6BAL","May 22, 2024 · 3:14 PM UTC",124,69
https://twitter.com/CNN/status/1793292686662782984#m,"A court chancellor rules in favor of Elvis Presley's granddaughter, putting an attempt to foreclose on Graceland, the late singer's home, on hold https://cnn.it/3KcUoPq","May 22, 2024 · 2:47 PM UTC",219,65
https://twitter.com/CNN/status/1793186992886317125#m,"Ireland, Norway and Spain say they will recognize a Palestinian state, a move likely to boost the Palestinian cause and strain relations with Israel https://cnn.it/3V8tT46","May 22, 2024 · 7:47 AM UTC",858,175
https://twitter.com/CNN/status/1793094433619030219#m,"Sean ""Diddy"" Combs has been accused of sexual assault in a new lawsuit filed by a former model https://cnn.it/3ywPBWE","May 22, 2024 · 1:40 AM UTC",293,89
https://twitter.com/CNN/status/1793069376901390440#m,"Prosecutor Fani Willis and Judge Scott McAfee, two key figures in Trump's Georgia election interference case, will win their elections in the state, CNN projects https://cnn.it/3yuNzpR","May 22, 2024 · 12:00 AM UTC",1066,223
https://twitter.com/CNN/status/1793055432828731428#m,Key Republican senators sharply criticized Supreme Court Justice Samuel Alito after news reports showed an upside-down American flag flying outside his home in 2021 https://cnn.it/3QVQpdI,"May 21, 2024 · 11:05 PM UTC",214,67
https://twitter.com/CNN/status/1793028441173872820#m,The Pentagon says none of the aid unloaded from a US pier off the coast of Gaza has been delivered to the broader Palestinian population https://cnn.it/3UPYQIW,"May 21, 2024 · 9:17 PM UTC",314,190
https://twitter.com/CNN/status/1793019074559000665#m,Israeli Prime Minister Netanyahu blasts International Criminal Court arrest warrant request in an interview with CNN's Jake Tapper https://cnn.it/4bPfqj8,"May 21, 2024 · 8:40 PM UTC",197,63
https://twitter.com/CNN/status/1793017667290292349#m,The NFL is launching a new initiative to help more minority businesses get contracts with the league. It comes amid a nationwide backlash to DEI programs. https://cnn.it/3WPgMWA,"May 21, 2024 · 8:34 PM UTC",144,59
https://twitter.com/CNN/status/1793010649527722485#m,"Egyptian intelligence quietly changed the ceasefire terms that were presented to Hamas in the last round of talks, sources say https://cnn.it/4dQNIUF","May 21, 2024 · 8:07 PM UTC",177,94
